{
  "$schema": "./fhevm-npm/schemas/cleartext-config.schema.json",
  "_readme": [
    "THE source of truth for every value the cleartext stack's languages must agree on.",
    "",
    "Above every generation on purpose. Every face is GENERATED from this file by `fhevm-npm",
    "generate-cleartext-config`, three per generation: the TypeScript module",
    "`common-vendored/src/cleartext-config-<gen>.ts` (synced into that generation's `pkg/ts/cleartext-config.ts`",
    "by `fhevm-npm sync vendored`), `create2-deploy/script/FhevmCleartextConfig.sol`, and",
    "`scripts/cleartext-config.sh` (sourced by the launchers). Each face is COMPLETE for its generation. This",
    "is the one place a value is DECIDED; every copy is a face of it. See",
    "host-contracts-cleartext/RULES.md rule 23.",
    "",
    "Why JSON and not TypeScript. Solidity cannot read a `.ts` module, and neither can a shell script, a",
    "Rust crate, or a CI job that wants a chain id without installing a toolchain. Every language in this",
    "repo can read JSON, and the emitted copies stay checked in — so an operator running `forge script`",
    "against a testnet from an unbuilt checkout is never blocked on a generator having run.",
    "",
    "## The shape of an entry",
    "",
    "  value      the value, as a string in every case — including integers. JSON numbers are IEEE doubles,",
    "             so a uint256 would silently lose precision on the way through a parser; a decimal string",
    "             cannot. Nothing here is fractional: every numeric value is a non-negative integer, and",
    "             there is no floating point anywhere in this file by construction.",
    "  alias      present instead of `value` when the constant is defined as another one. Both faces emit",
    "             the alias, not a repeat, so the two can never drift apart.",
    "  ts         the MINIMAL TypeScript type that holds the value exactly. A face may widen it — a uint",
    "             that fits a `number` also fits a `bigint`, so emitting `100733346448153n` where this says",
    "             `number` is fine. The reverse is not: a value that needs a `bigint` cannot be narrowed to",
    "             a `number` without losing digits, so `bigint` here is a floor and the check enforces it.",
    "  tsEmit     the literal shape the GENERATED TypeScript face emits when it deliberately widens `ts` —",
    "             always `bigint`, widening being the only direction allowed. Defaults to `ts`. Explicit",
    "             because the emitted shape is published API surface: a consumer typed against `bigint`",
    "             breaks if a regeneration silently narrows it.",
    "  solidity   the Solidity type the mirror declares. Also what tells a consumer how to compare the",
    "             value: `address` case-insensitively, `string` exactly, `uint*` numerically.",
    "  formula    for a derived value, the expression it comes from — see below.",
    "  generations  optional. The generations whose faces carry this constant — a subset of",
    "             `appliesTo.generations`. Absent means every one of them, which is the common case and",
    "             what every entry meant before the field existed. Set it when only one generation's",
    "             contracts have a field for the value: that generation's three faces emit it and no other",
    "             generation's do.",
    "  note       why the value is what it is. Required on every entry, and checked.",
    "",
    "## Why a derived value records its formula",
    "",
    "Three of these are keccak-derived, and the string being hashed is the real decision — the hex is only",
    "what it hashes to. Recording only the hex makes the value unverifiable: a mistyped digit looks exactly",
    "like a correct one, survives review, and then every copy of it agrees with every other. The formula is",
    "written in Solidity syntax and is EVALUATED by the check, not merely displayed, so it cannot become a",
    "comment that stopped being true. The preimage is not recorded separately: it is already in the formula,",
    "and a second copy of a value is the thing this whole file exists to prevent.",
    "",
    "## Exactness",
    "",
    "Key order is declaration order, and emitters preserve it. It is load-bearing for `alias` entries, which",
    "must be emitted after the constant they alias.",
    "",
    "Values are copied, never tidied. The mnemonic paths end in `/` because forge's `vm.deriveKey(mnemonic,",
    "path, index)` derives at `{path}{index}` by plain concatenation — a path written `m/44'/60'/0'/2`",
    "silently derives `m/44'/60'/0'/20` for index 0. That is a valid path, a real key and an entirely wrong",
    "signer set, and nothing else in a run notices: the stack deploys, verifies against itself, and fails",
    "only when the js-sdk relayer arrives with keys at the documented path."
  ],

  "appliesTo": {
    "generations": ["v14", "v15"],
    "_note": [
      "Every constant reaches every generation listed here unless it says otherwise: a constant carrying its own",
      "`generations` list is emitted only into those generations' faces. Each generation gets its own complete",
      "set of faces, so a shared constant appears in each — generated duplication from this one file, never a",
      "forked copy, which would be indistinguishable from drift. That is the per-generation mechanism this note",
      "used to ask for as an `overrides` block, in its smallest form: a scope on the one entry that needs it."
    ]
  },

  "constants": {
    "CLEARTEXT_GATEWAY_CHAIN_ID": {
      "value": "100733346448153",
      "ts": "number",
      "tsEmit": "bigint",
      "solidity": "uint256",
      "summary": "The gateway chain id, hashed from a name so it cannot collide with a real network.",
      "formula": "uint48(uint256(keccak256(\"fhevm.cheat.chainId cleartext gateway\")))",
      "note": "A cheat-code chain id: chosen by hashing a name so it cannot collide with a real network by accident, and so anyone can reproduce it from the string alone. Truncated to 48 bits because a chain id has to fit where chain ids are stored, and 2^48 is far above any real one while still being nowhere near a plausible typo of one. `ts` is `number` because the value fits a double exactly; the emitted face widens it to `bigint` (`tsEmit`) because a chain id is compared against bigint chain ids everywhere it is used."
    },

    "CLEARTEXT_RELAYER_URL": {
      "value": "https://relayer.cleartext.foo",
      "ts": "string",
      "solidity": "string",
      "summary": "The relayer URL, on a `.foo` TLD that cannot be registered.",
      "note": "Deliberately a `.foo` TLD, which cannot be registered. A cleartext stack has no relayer to talk to, so the URL exists only to be well-formed; pointing it at an unregistrable name means a client that ignores the cleartext path and actually dials it fails to resolve rather than reaching somebody's real host."
    },

    "CLEARTEXT_INPUT_VERIFICATION_ADDRESS": {
      "value": "0x6189F6c0c3E40B4a3c72ec86262295D78d845297",
      "ts": "string",
      "solidity": "address",
      "summary": "Where the gateway's input-verification contract is said to live. Never deployed.",
      "formula": "address(uint160(uint256(keccak256(\"fhevm.cheat.address cleartext input verification\"))))",
      "note": "Where the gateway's input-verification contract is *said* to live. Nothing is ever deployed there — the address is a name the cleartext path can carry in place of a real one. Hashed rather than picked so it cannot collide with a deployed contract on any chain, and so it is reproducible from the string. Stored EIP-55 checksummed because Solidity REJECTS a hex address literal containing letters unless it is (error 9429), while TypeScript does not care — so the checksummed spelling is the one both faces can use verbatim."
    },

    "CLEARTEXT_DECRYPTION_ADDRESS": {
      "value": "0xEaaA2FC6BC259dF015Aa7Dc8e59e0B67df622721",
      "ts": "string",
      "solidity": "address",
      "summary": "Where the gateway's decryption contract is said to live. Never deployed.",
      "formula": "address(uint160(uint256(keccak256(\"fhevm.cheat.address cleartext decryption\"))))",
      "note": "The same idea as the input-verification address, for the gateway's decryption contract: a hashed placeholder, never deployed, reproducible from its preimage, and checksummed for Solidity's sake."
    },

    "CLEARTEXT_COPROCESSOR_COUNT": {
      "value": "4",
      "ts": "number",
      "solidity": "uint256",
      "summary": "How many coprocessor signers the stack registers on `InputVerifier`.",
      "note": "How many coprocessor signers the stack registers on `InputVerifier`, and therefore how many keys are derived from the coprocessor HD path. Four rather than one because the multi-signer code paths are what a consumer exercises against a real deployment, and a stack with a single signer would let a bug in them pass unnoticed."
    },

    "CLEARTEXT_COPROCESSOR_THRESHOLD": {
      "value": "4",
      "ts": "number",
      "solidity": "uint256",
      "summary": "Signatures required on an input proof. Equal to the count, not a majority.",
      "note": "Equal to the count, not a majority. A cleartext stack has no real threshold cryptography whose partial failure it needs to tolerate, so requiring every signer keeps a missing or wrong one a loud failure instead of something the threshold silently absorbs."
    },

    "CLEARTEXT_KMS_NODE_COUNT": {
      "value": "4",
      "ts": "number",
      "solidity": "uint256",
      "summary": "How many KMS nodes the stack registers.",
      "note": "How many KMS nodes the stack registers. In v13 it is also the length of every per-node metadata array `ProtocolConfig` stores — signer, tx-sender, IP address, storage URL — and every KMS threshold equals it, for the reason `CLEARTEXT_COPROCESSOR_THRESHOLD` gives."
    },